id|id_cliente|id_epigrafe|id_proveedor|num|fecha|descripcion|base|iva|irpf|total|id_pagador|id_formapago|liquidado|fecha2|id_cuenta|id_proyecto
1|72|1|3|131/59|2012-11-23|tristique senectus et netus et malesuada fames ac turpis egestas. Fusce aliquet magna a neque. Nullam ut nisi a odio semper cursus. Integer mollis. Integer tincidunt aliquam arcu. Aliquam ultrices iaculis odio. Nam interdum enim non nisi. Aenean eget metus. In nec orci. Donec nibh. Quisque nonummy ipsum non arcu. Vivamus sit amet risus. Donec egestas. Aliquam nec enim. Nunc ut erat. Sed nunc est, mollis non, cursus non, egestas a, dui. Cras pellentesque. Sed dictum. Proin eget odio. Aliquam vulputate ullamcorper magna. Sed eu|86.96|15|0|100|1|1|1|2012-11-23|2|6
2|44|1|4|357/58|2012-12-01|semper auctor. Mauris vel turpis. Aliquam adipiscing lobortis risus. In mi pede, nonummy ut, molestie in, tempus eu, ligula. Aenean euismod mauris eu elit. Nulla facilisi. Sed neque. Sed eget lacus. Mauris non dui nec urna suscipit nonummy. Fusce fermentum fermentum arcu. Vestibulum ante ipsum primis in faucibus orci luctus et ultrices posuere cubilia Curae; Phasellus ornare. Fusce mollis. Duis sit amet diam|10|19|19|10|1|7|0|2012-12-01|1|2
3|92|1|3|183/13|2012-08-23|turpis egestas. Fusce aliquet magna a neque. Nullam ut nisi a odio semper cursus. Integer mollis. Integer tincidunt aliquam arcu. Aliquam ultrices iaculis odio. Nam interdum enim non nisi. Aenean eget metus. In nec orci. Donec nibh. Quisque nonummy ipsum non arcu. Vivamus sit amet risus. Donec|44.87|0|22|35|1|7|1|2012-08-23|2|5
4|0|1|8|162/18|2013-12-09|libero. Integer in magna. Phasellus dolor elit, pellentesque a, facilisis non, bibendum sed, est. Nunc laoreet lectus quis massa. Mauris vestibulum, neque sed dictum eleifend, nunc risus varius orci, in consequat enim diam vel arcu. Curabitur ut odio vel est tempor bibendum. Donec felis orci, adipiscing non, luctus sit amet, faucibus ut, nulla. Cras eu tellus eu augue porttitor interdum. Sed auctor odio a purus. Duis elementum, dui quis accumsan convallis, ante lectus convallis est, vitae sodales nisi magna sed dui. Fusce aliquam, enim nec tempus scelerisque, lorem ipsum sodales purus, in molestie tortor nibh sit amet orci. Ut|60|4|24|48|1|6|0|2013-12-09|2|0
5|92|1|1|427/77|2012-02-27|magna. Duis dignissim tempor arcu. Vestibulum ut eros non enim commodo hendrerit. Donec porttitor tellus non magna. Nam ligula elit, pretium et, rutrum non, hendrerit id, ante. Nunc mauris sapien, cursus in, hendrerit consectetuer, cursus et, magna. Praesent interdum ligula eu enim. Etiam imperdiet dictum magna. Ut tincidunt orci quis lectus. Nullam suscipit, est ac facilisis facilisis, magna tellus faucibus leo, in lobortis tellus justo sit amet nulla. Donec non justo. Proin non|76.04|5|9|73|1|3|0|2012-02-27|2|5
6|0|1|10|546/99|2012-06-01|luctus et ultrices posuere cubilia Curae; Phasellus ornare. Fusce mollis. Duis sit amet diam eu dolor egestas rhoncus. Proin nisl sem, consequat nec, mollis vitae, posuere at, velit. Cras lorem lorem, luctus ut, pellentesque eget, dictum placerat, augue. Sed molestie. Sed id risus quis diam luctus lobortis. Class aptent taciti sociosqu ad litora torquent per conubia|18.99|11|32|15|1|3|0|2012-06-01|1|0
7|58|1|7|929/62|2012-11-28|lobortis augue scelerisque mollis. Phasellus libero mauris, aliquam eu, accumsan sed, facilisis vitae, orci. Phasellus dapibus quam quis diam. Pellentesque habitant morbi tristique senectus et netus et malesuada fames ac turpis egestas. Fusce aliquet magna a neque. Nullam|71.96|18|11|77|1|2|0|2012-11-28|1|8
8|0|1|10|948/01|2013-05-14|Mauris eu turpis. Nulla aliquet. Proin velit. Sed malesuada augue ut lacus. Nulla tincidunt, neque vitae semper egestas, urna justo faucibus lectus, a sollicitudin orci sem eget massa. Suspendisse eleifend. Cras|66.67|6|16|60|1|7|1|2013-05-14|2|0
9|58|1|1|604/38|2013-12-30|ligula. Nullam enim. Sed nulla ante, iaculis nec, eleifend non, dapibus rutrum, justo. Praesent luctus. Curabitur egestas nunc sed libero. Proin sed turpis nec mauris blandit mattis. Cras eget nisi dictum augue malesuada malesuada. Integer|35.14|0|26|26|1|7|1|2013-12-30|2|8
10|58|1|2|246/84|2012-05-24|nascetur ridiculus mus. Donec dignissim magna a tortor. Nunc commodo auctor velit. Aliquam nisl. Nulla|68|3|28|51|1|3|0|2012-05-24|2|8
11|14|1|3|500/60|2012-09-17|Aliquam rutrum lorem ac risus. Morbi metus. Vivamus euismod urna. Nullam lobortis quam a felis ullamcorper viverra. Maecenas iaculis aliquet diam. Sed diam lorem, auctor quis, tristique ac, eleifend vitae, erat. Vivamus nisi. Mauris nulla. Integer urna. Vivamus molestie dapibus ligula. Aliquam erat volutpat. Nulla dignissim. Maecenas ornare egestas ligula. Nullam feugiat placerat velit. Quisque varius. Nam porttitor scelerisque neque. Nullam nisl. Maecenas malesuada fringilla est. Mauris eu turpis. Nulla aliquet. Proin velit. Sed malesuada augue ut lacus.|24.76|11|6|26|1|5|1|2012-09-17|2|3
12|68|1|10|357/78|2013-06-24|dolor egestas rhoncus. Proin nisl sem, consequat nec, mollis vitae, posuere at, velit. Cras lorem lorem, luctus ut, pellentesque eget, dictum placerat, augue. Sed molestie.|65.69|20|18|67|1|7|1|2013-06-24|2|7
13|58|1|0|852/92|2013-05-12|quis lectus. Nullam suscipit, est ac facilisis facilisis, magna tellus faucibus leo, in lobortis tellus justo sit amet nulla. Donec non justo. Proin non massa non ante bibendum ullamcorper. Duis cursus, diam at pretium aliquet, metus urna convallis erat, eget tincidunt dui augue eu tellus. Phasellus elit pede, malesuada vel, venenatis vel, faucibus id, libero. Donec consectetuer mauris id sapien. Cras dolor dolor, tempus non, lacinia at, iaculis quis, pede. Praesent eu dui. Cum sociis|14.47|0|24|11|1|5|1|2013-05-12|1|8
14|71|1|0|085/60|2013-09-22|tristique ac, eleifend vitae, erat. Vivamus nisi. Mauris nulla. Integer urna. Vivamus molestie dapibus ligula. Aliquam erat volutpat. Nulla dignissim. Maecenas ornare egestas ligula. Nullam feugiat placerat velit. Quisque varius. Nam porttitor scelerisque neque. Nullam nisl. Maecenas malesuada fringilla est. Mauris eu turpis. Nulla aliquet. Proin velit. Sed malesuada augue ut lacus. Nulla tincidunt, neque vitae semper egestas,|35|5|5|35|1|3|1|2013-09-22|1|10
15|14|1|6|632/63|2013-06-24|pede, nonummy ut, molestie in, tempus eu, ligula. Aenean euismod mauris eu elit. Nulla facilisi. Sed neque. Sed eget lacus. Mauris non dui nec urna suscipit nonummy. Fusce fermentum fermentum arcu.|20.41|21|23|20|1|7|0|2013-06-24|1|4
16|58|1|8|429/66|2013-02-01|nulla. Cras eu tellus eu augue porttitor interdum. Sed auctor odio a purus. Duis elementum, dui quis accumsan convallis, ante lectus convallis est, vitae sodales nisi magna sed dui. Fusce aliquam, enim nec tempus scelerisque, lorem ipsum sodales purus, in molestie tortor nibh sit amet orci. Ut sagittis lobortis mauris. Suspendisse aliquet molestie tellus. Aenean egestas hendrerit neque. In ornare sagittis felis. Donec tempor, est ac mattis semper, dui lectus rutrum urna, nec luctus felis purus ac tellus. Suspendisse sed dolor. Fusce mi lorem, vehicula et, rutrum eu, ultrices sit amet, risus.|55.45|18|17|56|1|1|1|2013-02-01|1|8
17|72|1|10|395/49|2013-07-12|Phasellus dolor elit, pellentesque a, facilisis non, bibendum sed, est. Nunc laoreet lectus quis massa. Mauris vestibulum, neque sed dictum eleifend, nunc risus varius orci, in consequat enim diam vel arcu. Curabitur ut odio vel est tempor|53.61|15|18|52|1|6|1|2013-07-12|1|6
18|65|1|0|615/16|2012-09-21|accumsan laoreet ipsum. Curabitur consequat, lectus sit amet luctus vulputate, nisi sem semper erat, in consectetuer ipsum nunc id enim. Curabitur massa. Vestibulum accumsan neque et nunc. Quisque ornare tortor at risus. Nunc ac sem ut dolor dapibus gravida. Aliquam tincidunt, nunc ac mattis ornare, lectus ante dictum mi, ac mattis velit justo nec ante. Maecenas mi felis, adipiscing fringilla, porttitor vulputate, posuere vulputate, lacus. Cras interdum. Nunc sollicitudin commodo ipsum. Suspendisse|28.3|9|3|30|1|5|0|2012-09-21|2|9
19|58|1|3|497/94|2012-12-10|lorem, sit amet ultricies sem magna nec quam. Curabitur vel lectus. Cum sociis natoque penatibus et magnis dis parturient montes, nascetur ridiculus mus. Donec dignissim magna a tortor. Nunc commodo auctor velit. Aliquam nisl. Nulla eu neque pellentesque massa lobortis ultrices. Vivamus rhoncus. Donec est. Nunc ullamcorper, velit in aliquet lobortis, nisi nibh lacinia orci, consectetuer euismod est arcu ac orci. Ut semper pretium neque. Morbi quis urna. Nunc quis arcu vel quam dignissim|22.12|7|3|23|1|7|0|2012-12-10|2|8
20|0|1|8|208/44|2012-04-12|interdum ligula eu enim. Etiam imperdiet dictum magna. Ut tincidunt orci quis lectus. Nullam suscipit, est ac facilisis facilisis, magna tellus faucibus leo, in lobortis tellus justo sit amet nulla. Donec non justo. Proin|91.14|2|23|72|1|1|1|2012-04-12|2|0
21|0|1|8|928/06|2013-03-08|molestie dapibus ligula. Aliquam erat volutpat. Nulla dignissim. Maecenas ornare egestas ligula. Nullam feugiat placerat velit. Quisque varius. Nam porttitor scelerisque neque. Nullam nisl. Maecenas malesuada fringilla est. Mauris eu turpis. Nulla aliquet. Proin velit. Sed malesuada augue ut lacus. Nulla tincidunt, neque vitae semper egestas, urna justo faucibus lectus, a sollicitudin orci sem eget massa. Suspendisse eleifend. Cras|35.42|7|11|34|1|6|0|2013-03-08|1|0
22|72|1|7|232/97|2013-05-19|hendrerit. Donec porttitor tellus non magna. Nam ligula elit, pretium et, rutrum non, hendrerit id, ante. Nunc mauris sapien, cursus in, hendrerit consectetuer, cursus et, magna. Praesent interdum ligula eu enim. Etiam imperdiet dictum magna. Ut tincidunt orci quis lectus. Nullam suscipit, est ac facilisis facilisis, magna|94.25|10|23|82|1|6|0|2013-05-19|1|6
23|71|1|0|293/50|2012-11-27|eget varius ultrices, mauris ipsum porta elit, a feugiat tellus lorem eu metus. In lorem. Donec elementum, lorem ut aliquam iaculis, lacus pede sagittis augue, eu tempor erat neque non quam. Pellentesque habitant morbi tristique senectus et netus et malesuada fames ac turpis egestas. Aliquam fringilla cursus purus. Nullam scelerisque neque sed sem egestas blandit. Nam nulla magna, malesuada vel, convallis in, cursus et, eros. Proin ultrices. Duis volutpat nunc sit amet metus. Aliquam erat volutpat. Nulla facilisis. Suspendisse commodo tincidunt nibh. Phasellus nulla. Integer vulputate, risus a ultricies adipiscing, enim mi tempor lorem,|30.21|21|25|29|1|6|1|2012-11-27|2|10
24|14|1|5|171/90|2012-04-15|erat, in consectetuer ipsum nunc id enim. Curabitur massa. Vestibulum accumsan neque et nunc. Quisque ornare tortor at risus. Nunc ac sem ut dolor dapibus gravida. Aliquam tincidunt, nunc ac mattis ornare, lectus ante dictum mi, ac mattis velit justo nec ante. Maecenas mi felis, adipiscing fringilla, porttitor vulputate, posuere vulputate, lacus. Cras interdum. Nunc sollicitudin commodo ipsum. Suspendisse non leo. Vivamus nibh dolor, nonummy ac, feugiat non, lobortis quis, pede. Suspendisse dui. Fusce diam nunc,|88.64|8|20|78|1|2|1|2012-04-15|2|3
25|65|1|2|869/02|2012-12-26|dictum ultricies ligula. Nullam enim. Sed nulla ante, iaculis nec, eleifend non, dapibus rutrum, justo. Praesent luctus. Curabitur egestas nunc sed libero. Proin sed turpis nec mauris blandit mattis. Cras eget nisi dictum augue malesuada malesuada. Integer id magna et ipsum cursus vestibulum. Mauris magna. Duis dignissim tempor arcu. Vestibulum ut eros non enim commodo hendrerit. Donec porttitor tellus non magna. Nam ligula elit, pretium et, rutrum non, hendrerit id, ante. Nunc mauris sapien, cursus in, hendrerit consectetuer, cursus et, magna. Praesent interdum ligula eu enim. Etiam imperdiet dictum|54.55|17|29|48|1|1|0|2012-12-26|1|9
26|92|1|9|354/09|2012-06-01|mollis dui, in sodales elit erat vitae risus. Duis a mi fringilla mi lacinia mattis. Integer eu lacus. Quisque imperdiet, erat nonummy ultricies ornare, elit elit fermentum risus, at fringilla purus|44.44|12|22|40|1|2|1|2012-06-01|1|5
27|92|1|0|338/76|2012-09-03|Aliquam erat volutpat. Nulla facilisis. Suspendisse commodo tincidunt nibh. Phasellus nulla. Integer vulputate, risus a ultricies adipiscing, enim mi tempor lorem, eget mollis lectus pede et risus. Quisque libero lacus, varius et, euismod et, commodo at, libero. Morbi accumsan laoreet ipsum. Curabitur consequat, lectus sit amet luctus vulputate, nisi sem semper erat, in consectetuer ipsum nunc id enim. Curabitur massa. Vestibulum accumsan neque et nunc. Quisque ornare tortor at risus. Nunc ac sem ut dolor dapibus gravida. Aliquam tincidunt, nunc ac mattis ornare,|26.13|15|4|29|1|6|1|2012-09-03|2|5
28|65|1|3|379/65|2012-08-05|penatibus et magnis dis parturient montes, nascetur ridiculus mus. Aenean eget magna. Suspendisse tristique neque venenatis lacus. Etiam bibendum fermentum metus. Aenean sed pede nec ante blandit viverra. Donec tempus, lorem fringilla ornare placerat, orci lacus vestibulum lorem, sit amet ultricies sem magna nec|87.5|18|30|77|1|1|0|2012-08-05|2|9
29|14|1|8|729/98|2014-01-02|orci lacus vestibulum lorem, sit amet ultricies sem magna nec quam. Curabitur vel lectus. Cum sociis natoque penatibus et magnis dis parturient montes, nascetur ridiculus mus. Donec dignissim magna a tortor. Nunc commodo auctor velit. Aliquam nisl. Nulla eu neque pellentesque massa lobortis ultrices. Vivamus|10.28|20|13|11|1|7|1|2014-01-02|2|4
30|72|1|1|549/23|2013-06-24|mus. Proin vel arcu eu odio tristique pharetra. Quisque ac libero nec ligula consectetuer rhoncus. Nullam velit dui, semper et,|103.08|0|35|67|1|7|1|2013-06-24|2|6
31|92|1|3|506/53|2012-08-27|penatibus et magnis dis parturient montes, nascetur ridiculus mus. Proin vel arcu eu odio tristique pharetra. Quisque ac libero nec ligula consectetuer rhoncus. Nullam velit dui, semper et, lacinia vitae, sodales at, velit. Pellentesque ultricies dignissim lacus. Aliquam rutrum lorem ac risus. Morbi metus. Vivamus euismod urna. Nullam|15.96|18|24|15|1|2|0|2012-08-27|1|5
32|62|1|9|808/58|2012-12-11|Nullam nisl. Maecenas malesuada fringilla est. Mauris eu turpis. Nulla aliquet. Proin velit. Sed malesuada augue ut lacus. Nulla tincidunt, neque vitae semper egestas, urna justo faucibus lectus, a sollicitudin orci sem eget massa. Suspendisse eleifend. Cras sed leo. Cras vehicula aliquet libero. Integer in magna. Phasellus dolor elit, pellentesque a, facilisis non, bibendum sed, est. Nunc|83.84|3|4|83|1|7|1|2012-12-11|1|1
33|14|1|5|641/74|2013-02-14|Phasellus ornare. Fusce mollis. Duis sit amet diam eu dolor egestas rhoncus. Proin nisl sem, consequat nec, mollis vitae, posuere at, velit. Cras lorem lorem, luctus ut, pellentesque eget, dictum placerat, augue. Sed molestie. Sed id risus quis diam luctus lobortis. Class aptent taciti sociosqu ad|34.75|19|1|41|1|7|0|2013-02-14|2|4
34|44|1|9|929/76|2013-05-13|magna. Nam ligula elit, pretium et, rutrum non, hendrerit id, ante. Nunc mauris sapien, cursus in, hendrerit consectetuer, cursus et, magna. Praesent interdum ligula eu enim. Etiam imperdiet dictum magna. Ut tincidunt orci quis lectus. Nullam suscipit, est ac facilisis facilisis, magna tellus faucibus leo, in lobortis tellus justo sit amet nulla. Donec non justo. Proin non massa non ante bibendum ullamcorper. Duis|53.41|16|28|47|1|5|1|2013-05-13|1|2
35|44|1|5|575/94|2013-02-23|porttitor eros nec tellus. Nunc lectus pede, ultrices a, auctor non, feugiat nec, diam. Duis mi enim, condimentum eget, volutpat ornare, facilisis eget, ipsum. Donec sollicitudin adipiscing ligula. Aenean gravida nunc sed pede. Cum sociis natoque penatibus et magnis dis parturient montes, nascetur ridiculus mus. Proin vel arcu eu odio|13.13|19|20|13|1|5|0|2013-02-23|1|2
36|58|1|8|795/12|2014-02-01|rutrum. Fusce dolor quam, elementum at, egestas a, scelerisque sed, sapien. Nunc pulvinar arcu et pede. Nunc|61.86|7|10|60|1|1|0|2014-02-01|2|8
37|65|1|1|766/73|2013-10-09|eget metus eu erat semper rutrum. Fusce dolor quam, elementum at, egestas a, scelerisque sed, sapien. Nunc pulvinar arcu et pede. Nunc sed orci lobortis|35.14|8|34|26|1|7|0|2013-10-09|2|9
38|44|1|10|112/69|2013-09-19|ac, fermentum vel, mauris. Integer sem elit, pharetra ut, pharetra sed, hendrerit a, arcu. Sed et libero. Proin mi. Aliquam|19.15|19|25|18|1|5|1|2013-09-19|1|2
39|72|1|3|022/24|2012-10-27|Maecenas iaculis aliquet diam. Sed diam lorem, auctor quis, tristique ac, eleifend vitae, erat. Vivamus nisi. Mauris nulla. Integer urna. Vivamus molestie dapibus ligula. Aliquam erat volutpat. Nulla dignissim. Maecenas ornare egestas ligula. Nullam feugiat placerat velit. Quisque varius. Nam porttitor scelerisque neque. Nullam nisl. Maecenas malesuada fringilla est. Mauris eu turpis. Nulla aliquet. Proin velit. Sed malesuada augue ut lacus. Nulla tincidunt, neque vitae semper egestas, urna justo faucibus lectus, a sollicitudin orci sem eget massa. Suspendisse eleifend. Cras sed leo. Cras vehicula aliquet libero. Integer in magna. Phasellus dolor elit, pellentesque a, facilisis non, bibendum|12.09|19|28|11|1|3|0|2012-10-27|1|6
40|68|1|5|402/50|2012-03-29|ornare, libero at auctor ullamcorper, nisl arcu iaculis enim, sit amet ornare lectus justo eu arcu. Morbi sit amet massa. Quisque porttitor eros nec tellus. Nunc lectus pede, ultrices a, auctor non, feugiat nec, diam. Duis mi enim, condimentum eget, volutpat ornare, facilisis eget, ipsum. Donec sollicitudin adipiscing ligula. Aenean gravida nunc sed pede. Cum sociis natoque penatibus et magnis dis parturient montes, nascetur ridiculus mus. Proin vel arcu eu odio tristique pharetra. Quisque ac|63.89|21|13|69|1|3|1|2012-03-29|1|7
41|65|1|0|438/41|2014-02-13|vel, faucibus id, libero. Donec consectetuer mauris id sapien. Cras dolor dolor, tempus non, lacinia at, iaculis quis, pede. Praesent eu dui. Cum sociis natoque penatibus et magnis dis parturient montes, nascetur ridiculus mus. Aenean eget magna. Suspendisse tristique neque venenatis lacus. Etiam bibendum fermentum metus. Aenean sed pede nec ante blandit viverra. Donec tempus, lorem fringilla ornare placerat, orci lacus vestibulum lorem, sit amet ultricies sem magna nec quam. Curabitur vel lectus. Cum sociis|53.25|6|29|41|1|3|0|2014-02-13|1|9
42|62|1|1|275/99|2013-04-24|elit erat vitae risus. Duis a mi fringilla mi lacinia mattis. Integer eu lacus. Quisque imperdiet, erat nonummy ultricies ornare, elit elit fermentum risus, at fringilla purus mauris a nunc. In at pede. Cras vulputate velit eu sem. Pellentesque ut ipsum ac mi eleifend egestas. Sed pharetra, felis eget varius ultrices, mauris ipsum porta elit, a feugiat tellus lorem eu metus. In lorem. Donec elementum, lorem ut aliquam iaculis, lacus pede sagittis augue, eu tempor erat neque non quam. Pellentesque habitant morbi tristique senectus et netus et malesuada fames ac turpis egestas. Aliquam fringilla cursus purus.|84.26|13|5|91|1|6|0|2013-04-24|1|1
43|0|1|8|445/82|2013-10-28|cubilia Curae; Phasellus ornare. Fusce mollis. Duis sit amet diam eu dolor egestas rhoncus. Proin nisl sem, consequat nec, mollis vitae, posuere at, velit. Cras lorem lorem, luctus ut, pellentesque eget, dictum placerat, augue. Sed molestie. Sed id risus quis diam luctus lobortis. Class aptent taciti sociosqu ad litora torquent per conubia nostra, per inceptos hymenaeos. Mauris ut quam vel sapien imperdiet ornare. In faucibus. Morbi vehicula. Pellentesque tincidunt tempus risus. Donec egestas. Duis ac arcu. Nunc mauris. Morbi non sapien molestie orci tincidunt adipiscing. Mauris molestie pharetra|30.68|15|27|27|1|2|1|2013-10-28|1|0
44|62|1|9|499/35|2012-08-27|dolor. Fusce mi lorem, vehicula et, rutrum eu, ultrices sit amet, risus. Donec nibh enim, gravida sit amet, dapibus id, blandit at, nisi. Cum sociis natoque penatibus et magnis dis parturient montes, nascetur ridiculus mus. Proin vel nisl. Quisque fringilla euismod enim. Etiam gravida molestie arcu. Sed eu nibh vulputate mauris sagittis placerat. Cras dictum ultricies ligula. Nullam enim. Sed nulla ante, iaculis nec, eleifend|29.41|15|30|25|1|3|1|2012-08-27|2|1
45|62|1|4|261/44|2014-01-14|dictum eleifend, nunc risus varius orci, in consequat enim diam vel arcu. Curabitur ut odio vel est tempor bibendum. Donec felis orci, adipiscing non, luctus sit amet, faucibus|37.78|4|14|34|1|5|0|2014-01-14|2|1
46|44|1|7|835/98|2012-12-28|pretium et, rutrum non, hendrerit id, ante. Nunc mauris sapien, cursus in, hendrerit consectetuer, cursus et, magna. Praesent interdum ligula eu enim. Etiam imperdiet dictum magna. Ut tincidunt orci quis lectus. Nullam suscipit, est ac facilisis facilisis, magna tellus faucibus leo, in lobortis tellus justo sit amet nulla. Donec non justo. Proin non massa non ante bibendum ullamcorper. Duis cursus, diam at pretium aliquet, metus urna convallis erat, eget tincidunt dui augue eu tellus. Phasellus elit pede, malesuada vel, venenatis vel, faucibus id, libero. Donec|71.84|21|18|74|1|1|0|2012-12-28|2|2
47|65|1|7|691/90|2013-08-14|id ante dictum cursus. Nunc mauris elit, dictum eu, eleifend nec, malesuada ut, sem. Nulla interdum. Curabitur dictum. Phasellus in felis. Nulla tempor augue ac ipsum. Phasellus vitae mauris sit amet lorem semper auctor. Mauris vel turpis. Aliquam adipiscing lobortis risus. In mi pede, nonummy ut, molestie in, tempus eu, ligula. Aenean euismod mauris eu elit. Nulla facilisi. Sed neque. Sed eget lacus. Mauris non dui nec urna suscipit nonummy. Fusce fermentum fermentum arcu. Vestibulum ante ipsum primis in faucibus orci luctus et ultrices posuere cubilia Curae; Phasellus ornare. Fusce mollis. Duis sit amet|73.27|1|0|74|1|1|0|2013-08-14|2|9
48|62|1|4|609/34|2013-10-05|fermentum metus. Aenean sed pede nec ante blandit viverra. Donec tempus, lorem fringilla ornare placerat, orci lacus vestibulum lorem, sit amet ultricies sem magna nec quam. Curabitur vel lectus. Cum sociis natoque penatibus et magnis dis parturient montes, nascetur ridiculus mus. Donec dignissim magna a tortor. Nunc commodo auctor velit. Aliquam nisl. Nulla eu neque pellentesque massa lobortis ultrices. Vivamus rhoncus. Donec est. Nunc ullamcorper, velit in aliquet lobortis, nisi nibh lacinia orci, consectetuer euismod est|93.98|0|17|78|1|1|1|2013-10-05|2|1
49|14|1|3|783/45|2013-05-15|tellus. Suspendisse sed dolor. Fusce mi lorem, vehicula et, rutrum eu, ultrices sit amet, risus. Donec nibh enim, gravida sit amet,|89.72|20|13|96|1|6|0|2013-05-15|1|4
50|65|1|1|505/27|2013-06-22|nunc id enim. Curabitur massa. Vestibulum accumsan neque et nunc. Quisque ornare tortor at risus. Nunc ac sem ut dolor dapibus gravida. Aliquam tincidunt, nunc ac mattis ornare, lectus ante dictum mi, ac mattis velit justo nec ante. Maecenas mi felis, adipiscing fringilla, porttitor vulputate, posuere vulputate, lacus. Cras interdum. Nunc sollicitudin commodo ipsum. Suspendisse non leo. Vivamus nibh dolor, nonummy ac, feugiat non, lobortis quis, pede. Suspendisse dui. Fusce diam nunc, ullamcorper eu, euismod ac, fermentum vel,|41.67|19|23|40|1|2|0|2013-06-22|1|9
51|65|1|3|657/59|2013-08-07|id magna et ipsum cursus vestibulum. Mauris magna. Duis dignissim tempor arcu. Vestibulum ut eros non enim commodo hendrerit. Donec porttitor tellus non magna. Nam ligula elit, pretium et, rutrum non, hendrerit id, ante. Nunc mauris sapien, cursus in, hendrerit consectetuer, cursus et, magna. Praesent interdum ligula eu enim. Etiam imperdiet dictum magna. Ut tincidunt orci quis lectus. Nullam suscipit, est ac facilisis facilisis, magna tellus faucibus leo, in lobortis tellus justo sit amet nulla. Donec non justo. Proin|35.64|4|3|36|1|6|0|2013-08-07|2|9
52|62|1|8|654/07|2012-07-26|sit amet lorem semper auctor. Mauris vel turpis. Aliquam adipiscing lobortis risus. In mi pede, nonummy ut, molestie in, tempus eu, ligula. Aenean euismod mauris eu elit. Nulla facilisi. Sed neque. Sed eget lacus. Mauris non dui nec urna suscipit nonummy. Fusce fermentum fermentum arcu. Vestibulum ante ipsum primis in faucibus orci luctus et ultrices posuere cubilia Curae; Phasellus ornare. Fusce mollis. Duis sit amet diam eu dolor egestas rhoncus. Proin nisl sem, consequat nec, mollis vitae, posuere at, velit. Cras lorem lorem, luctus ut, pellentesque eget, dictum|101.23|15|34|82|1|6|0|2012-07-26|2|1
53|0|1|7|578/80|2012-06-18|sodales. Mauris blandit enim consequat purus. Maecenas libero est, congue a, aliquet vel, vulputate eu, odio. Phasellus at augue id ante dictum cursus. Nunc mauris elit, dictum eu, eleifend nec, malesuada ut, sem. Nulla interdum. Curabitur dictum. Phasellus in felis. Nulla tempor augue ac ipsum. Phasellus vitae|69.79|6|10|67|1|7|0|2012-06-18|2|0
54|65|1|2|011/81|2013-03-01|arcu. Vestibulum ante ipsum primis in faucibus orci luctus et ultrices posuere cubilia Curae; Phasellus ornare. Fusce mollis. Duis sit amet diam eu dolor egestas rhoncus. Proin nisl sem, consequat nec, mollis vitae, posuere at, velit. Cras lorem lorem, luctus ut, pellentesque eget, dictum placerat, augue. Sed molestie. Sed id risus quis diam luctus lobortis. Class aptent taciti sociosqu ad litora torquent per conubia nostra, per inceptos hymenaeos. Mauris ut quam vel sapien imperdiet ornare. In faucibus. Morbi vehicula.|53.47|19|18|54|1|7|0|2013-03-01|2|9
55|65|1|0|213/82|2012-09-07|lacus. Quisque purus sapien, gravida non, sollicitudin a, malesuada id, erat. Etiam vestibulum massa rutrum magna. Cras convallis convallis dolor. Quisque tincidunt pede ac urna. Ut tincidunt vehicula risus. Nulla eget metus eu erat semper rutrum. Fusce|38.67|7|32|29|1|3|0|2012-09-07|2|9
56|92|1|1|536/90|2013-10-21|adipiscing lobortis risus. In mi pede, nonummy ut, molestie in, tempus eu, ligula. Aenean euismod mauris eu elit. Nulla facilisi. Sed neque. Sed eget lacus. Mauris non dui nec urna suscipit nonummy. Fusce fermentum fermentum arcu. Vestibulum ante ipsum primis in faucibus orci luctus et ultrices posuere cubilia Curae; Phasellus ornare. Fusce mollis. Duis sit amet diam eu dolor egestas rhoncus. Proin nisl sem, consequat nec, mollis vitae, posuere at,|37.89|11|16|36|1|7|0|2013-10-21|2|5
