id|nombre|nombre1|nombre2|cif|comentarios|corriente|contable|diapago
88|nec, diam. Duis mi enim,|erat neque non quam. Pellentesque habitant|Phasellus nulla. Integer vulputate, risus a ultricies adipiscing, enim|40653312-T|lacus. Quisque imperdiet, erat nonummy ultricies ornare, elit elit fermentum risus, at fringilla purus mauris a nunc. In at pede. Cras vulputate velit eu sem. Pellentesque ut ipsum ac mi eleifend egestas. Sed pharetra, felis eget varius ultrices, mauris ipsum porta elit, a feugiat tellus lorem eu metus. In lorem. Donec elementum, lorem ut aliquam iaculis, lacus pede sagittis augue, eu tempor erat neque non quam. Pellentesque habitant morbi tristique senectus et netus et malesuada fames ac turpis egestas.|9988-6572-16-1375408386|893|11
89|Etiam bibendum fermentum metus. Aenean sed|mattis semper, dui lectus rutrum urna, nec luctus|Quisque ac libero nec ligula consectetuer rhoncus.|33222879-D|ligula eu enim. Etiam imperdiet dictum magna. Ut tincidunt orci quis lectus. Nullam suscipit, est ac facilisis facilisis, magna tellus faucibus leo, in lobortis tellus justo sit amet nulla. Donec non justo. Proin non massa non ante bibendum ullamcorper. Duis cursus, diam at pretium aliquet, metus urna convallis erat, eget tincidunt dui augue eu tellus. Phasellus elit pede, malesuada vel, venenatis vel, faucibus id, libero. Donec consectetuer mauris id sapien. Cras dolor dolor, tempus non, lacinia at, iaculis quis, pede. Praesent eu dui. Cum sociis natoque penatibus et magnis dis parturient montes, nascetur ridiculus mus. Aenean eget magna. Suspendisse|2338-8462-33-0264539073|305|18
90|sagittis felis. Donec tempor, est ac|lobortis risus. In mi pede, nonummy ut,|Suspendisse eleifend. Cras sed leo. Cras vehicula aliquet|89727663-W|Donec tempus, lorem fringilla ornare placerat, orci lacus vestibulum lorem, sit amet ultricies sem magna nec quam. Curabitur vel lectus. Cum sociis natoque penatibus et magnis dis parturient montes, nascetur ridiculus mus. Donec dignissim magna a tortor. Nunc commodo auctor velit. Aliquam nisl. Nulla eu neque pellentesque massa lobortis ultrices. Vivamus rhoncus. Donec est. Nunc ullamcorper, velit in aliquet lobortis, nisi nibh lacinia orci, consectetuer euismod est arcu ac orci. Ut semper pretium neque. Morbi quis urna. Nunc quis arcu vel quam dignissim pharetra. Nam ac nulla. In tincidunt congue turpis. In condimentum. Donec at arcu. Vestibulum ante ipsum primis|8232-8729-45-3419763937|725|1
91|euismod mauris eu elit. Nulla|Mauris eu turpis. Nulla aliquet. Proin velit. Sed malesuada|tempus, lorem fringilla ornare placerat,|19942815-S|aliquam arcu. Aliquam ultrices iaculis odio. Nam interdum enim non nisi. Aenean eget metus. In nec orci. Donec nibh. Quisque nonummy ipsum non arcu. Vivamus sit amet risus. Donec egestas. Aliquam nec enim. Nunc ut erat. Sed nunc est, mollis non, cursus non, egestas a, dui. Cras pellentesque. Sed dictum. Proin eget odio. Aliquam vulputate ullamcorper magna. Sed eu eros. Nam consequat dolor vitae dolor. Donec fringilla.|0129-8938-21-6466493899|999|14
92|nulla vulputate dui, nec tempus|et magnis dis parturient montes, nascetur ridiculus mus. Aenean|arcu iaculis enim, sit amet ornare lectus|75494398-D|lacus. Cras interdum. Nunc sollicitudin commodo ipsum. Suspendisse non leo. Vivamus nibh dolor, nonummy ac, feugiat non, lobortis quis, pede. Suspendisse dui. Fusce diam nunc, ullamcorper|7664-1570-57-0465541294|949|27
93|euismod mauris eu elit. Nulla facilisi. Sed neque. Sed eget|Vestibulum ante ipsum primis in faucibus orci luctus et ultrices|tristique senectus et netus et malesuada fames|61735983-Z|nibh. Quisque nonummy ipsum non arcu. Vivamus sit amet risus. Donec egestas. Aliquam nec enim. Nunc ut erat. Sed nunc est, mollis non, cursus non, egestas a, dui. Cras pellentesque. Sed dictum. Proin eget odio. Aliquam vulputate ullamcorper magna. Sed eu eros. Nam consequat|0775-3275-12-5514433174|881|5
94|aliquet magna a neque. Nullam ut nisi|at pede. Cras vulputate velit|bibendum sed, est. Nunc laoreet|90266583-E|mauris sapien, cursus in, hendrerit consectetuer, cursus et, magna. Praesent interdum|7571-0051-79-0612122926|838|16
95|tellus. Aenean egestas hendrerit neque. In ornare sagittis felis. Donec|nostra, per inceptos hymenaeos. Mauris ut quam|interdum. Sed auctor odio a purus. Duis elementum,|83055060-E|vitae, orci. Phasellus dapibus quam quis diam. Pellentesque habitant morbi tristique senectus et netus et malesuada fames ac turpis egestas. Fusce aliquet magna a neque. Nullam ut nisi a odio semper cursus. Integer mollis. Integer tincidunt aliquam arcu. Aliquam ultrices iaculis odio. Nam interdum enim non nisi. Aenean eget metus. In|2114-2361-63-0925870134|974|16
96|felis purus ac tellus. Suspendisse sed|velit. Quisque varius. Nam porttitor scelerisque|Etiam bibendum fermentum metus. Aenean sed pede nec ante|49763000-F|pharetra. Quisque ac libero nec ligula consectetuer rhoncus. Nullam velit dui, semper et, lacinia vitae, sodales at, velit. Pellentesque ultricies dignissim lacus. Aliquam rutrum lorem ac risus. Morbi metus. Vivamus euismod urna. Nullam lobortis quam a felis ullamcorper viverra. Maecenas iaculis aliquet diam. Sed diam lorem, auctor quis, tristique ac, eleifend vitae, erat. Vivamus nisi. Mauris nulla. Integer urna. Vivamus molestie dapibus ligula. Aliquam erat volutpat. Nulla dignissim. Maecenas ornare|2658-4385-72-5470722199|687|7
97|vitae velit egestas lacinia. Sed congue,|ipsum. Phasellus vitae mauris sit amet|ac mattis ornare, lectus ante dictum mi, ac mattis velit|51519948-O|non arcu. Vivamus sit amet risus. Donec egestas. Aliquam nec enim. Nunc ut erat. Sed nunc est, mollis non, cursus non, egestas a, dui. Cras pellentesque. Sed dictum.|0681-4146-04-2914197386|801|1
98|elementum sem, vitae aliquam eros|tellus lorem eu metus. In lorem. Donec elementum,|lobortis, nisi nibh lacinia orci, consectetuer euismod est arcu|98379894-L|vulputate, nisi sem semper erat, in consectetuer ipsum nunc id enim. Curabitur|6900-1974-84-3853978745|629|14
99|mollis dui, in sodales elit erat|tortor. Nunc commodo auctor velit. Aliquam nisl.|dictum eleifend, nunc risus varius orci,|58469566-A|ultrices iaculis odio. Nam interdum enim non nisi. Aenean eget metus. In nec orci. Donec nibh. Quisque nonummy ipsum non arcu. Vivamus sit amet risus. Donec egestas. Aliquam nec enim. Nunc ut erat. Sed nunc est, mollis non, cursus non, egestas a, dui. Cras pellentesque. Sed dictum. Proin eget odio. Aliquam vulputate ullamcorper magna. Sed eu|3467-3360-72-7022206920|504|6
100|arcu imperdiet ullamcorper. Duis at lacus. Quisque purus sapien, gravida|venenatis lacus. Etiam bibendum fermentum metus. Aenean sed pede nec|Nulla dignissim. Maecenas ornare egestas|73731077-E|imperdiet ullamcorper. Duis at lacus. Quisque purus sapien, gravida non, sollicitudin a, malesuada id, erat. Etiam vestibulum massa rutrum magna. Cras convallis convallis dolor. Quisque tincidunt pede ac urna. Ut tincidunt vehicula risus. Nulla eget metus eu erat semper rutrum. Fusce dolor quam, elementum at, egestas a, scelerisque sed, sapien. Nunc pulvinar arcu et pede. Nunc sed orci lobortis augue scelerisque|8521-8277-48-2524423137|865|8

