id|id_cliente|id_epigrafe|id_proveedor|num|fecha|descripcion|base|iva|irpf|total|id_pagador|id_formapago|liquidado|fecha2|id_cuenta|id_proyecto
57|0|1|5|454/60|2012-05-29|Curabitur sed tortor. Integer aliquam adipiscing lacus. Ut nec urna et arcu imperdiet ullamcorper. Duis at lacus. Quisque purus sapien, gravida non, sollicitudin a, malesuada id, erat. Etiam vestibulum massa rutrum magna. Cras convallis convallis dolor. Quisque tincidunt pede ac urna. Ut tincidunt vehicula risus. Nulla eget metus eu|40.23|6|19|35|1|3|1|2012-05-29|1|0
58|72|1|2|127/48|2012-08-27|aliquam iaculis, lacus pede sagittis augue, eu tempor erat neque non quam. Pellentesque habitant morbi tristique senectus et netus et malesuada fames ac turpis egestas. Aliquam fringilla cursus purus. Nullam scelerisque neque sed sem egestas blandit. Nam nulla magna, malesuada vel, convallis in, cursus et, eros.|88.24|20|18|90|1|3|0|2012-08-27|2|6
59|92|1|6|261/50|2013-06-24|interdum. Curabitur dictum. Phasellus in felis. Nulla tempor augue ac ipsum. Phasellus vitae mauris sit amet lorem semper auctor. Mauris vel turpis. Aliquam adipiscing lobortis risus. In mi|109.46|5|31|81|1|3|0|2013-06-24|2|5
60|71|1|3|558/40|2012-07-23|Proin dolor. Nulla semper tellus id nunc interdum feugiat. Sed nec metus facilisis lorem tristique aliquet. Phasellus fermentum convallis ligula. Donec luctus aliquet odio. Etiam ligula tortor, dictum eu, placerat eget, venenatis a, magna. Lorem ipsum dolor sit amet, consectetuer adipiscing elit. Etiam laoreet, libero et tristique pellentesque, tellus sem mollis dui, in sodales elit erat vitae risus. Duis a mi fringilla mi lacinia mattis. Integer eu lacus. Quisque imperdiet, erat nonummy ultricies ornare, elit elit fermentum risus, at fringilla purus|34|8|8|34|1|5|1|2012-07-23|1|10
61|68|1|1|050/80|2012-11-30|quam. Pellentesque habitant morbi tristique senectus et netus et malesuada fames ac turpis egestas. Aliquam fringilla|107.95|12|24|95|1|2|0|2012-11-30|1|7
62|14|1|4|496/78|2013-06-30|Proin non massa non ante bibendum ullamcorper. Duis cursus, diam at pretium aliquet, metus urna convallis erat, eget tincidunt dui augue eu|46.34|2|20|38|1|6|1|2013-06-30|2|4
63|14|1|3|299/18|2013-03-01|natoque penatibus et magnis dis parturient montes, nascetur ridiculus mus. Donec dignissim magna a tortor. Nunc commodo auctor velit. Aliquam nisl. Nulla eu neque pellentesque massa lobortis|14.41|18|7|16|1|7|1|2013-03-01|1|4
64|14|1|10|815/14|2013-05-15|a, scelerisque sed, sapien. Nunc pulvinar arcu et pede. Nunc sed orci lobortis augue scelerisque mollis. Phasellus libero mauris, aliquam eu, accumsan sed, facilisis vitae,|23.38|12|35|18|1|2|0|2013-05-15|2|4
65|44|1|1|383/41|2012-06-14|Cras vehicula aliquet libero. Integer in magna. Phasellus dolor elit,|23.23|8|9|23|1|1|0|2012-06-14|2|2
66|44|1|3|473/55|2012-03-23|et ipsum cursus vestibulum. Mauris magna. Duis dignissim tempor arcu. Vestibulum ut eros non enim commodo hendrerit. Donec porttitor tellus non magna. Nam ligula elit, pretium et, rutrum non, hendrerit id, ante. Nunc mauris sapien, cursus in, hendrerit consectetuer, cursus et, magna. Praesent interdum ligula eu enim. Etiam imperdiet dictum magna. Ut tincidunt orci quis lectus. Nullam suscipit, est ac|44.86|21|14|48|1|3|0|2012-03-23|2|2
67|68|1|7|489/62|2012-05-20|nunc ac mattis ornare, lectus ante dictum mi, ac mattis velit justo|43.9|6|24|36|1|1|1|2012-05-20|2|7
68|62|1|3|947/35|2013-02-21|ridiculus mus. Aenean eget magna. Suspendisse tristique neque venenatis lacus. Etiam bibendum fermentum metus. Aenean sed pede nec ante blandit viverra. Donec tempus, lorem fringilla ornare placerat, orci lacus vestibulum lorem, sit amet ultricies sem magna nec quam. Curabitur vel lectus. Cum sociis natoque penatibus et magnis dis parturient montes, nascetur ridiculus mus. Donec dignissim magna|44.74|16|2|51|1|5|0|2013-02-21|2|1
69|71|1|0|667/92|2013-12-04|ut dolor dapibus gravida. Aliquam tincidunt, nunc ac mattis ornare, lectus ante dictum mi, ac mattis velit justo nec ante. Maecenas mi felis, adipiscing fringilla, porttitor vulputate, posuere vulputate, lacus. Cras interdum. Nunc sollicitudin commodo ipsum. Suspendisse non leo. Vivamus nibh dolor, nonummy ac, feugiat non, lobortis quis, pede. Suspendisse dui. Fusce diam nunc, ullamcorper eu, euismod ac, fermentum vel, mauris. Integer sem elit, pharetra ut, pharetra sed, hendrerit a, arcu. Sed et libero. Proin mi. Aliquam gravida mauris ut mi. Duis risus odio, auctor vitae, aliquet nec, imperdiet nec, leo. Morbi|64.89|13|19|61|1|5|0|2013-12-04|1|10
70|92|1|6|586/02|2012-12-14|ullamcorper, nisl arcu iaculis enim, sit amet ornare lectus justo eu arcu. Morbi sit amet massa. Quisque porttitor eros nec tellus. Nunc lectus pede, ultrices a, auctor|123.08|7|29|96|1|5|1|2012-12-14|1|5
71|72|1|4|969/46|2012-09-16|Fusce aliquam, enim nec tempus scelerisque, lorem ipsum sodales purus, in molestie tortor nibh sit amet orci. Ut sagittis lobortis mauris. Suspendisse aliquet molestie tellus. Aenean egestas hendrerit neque. In ornare sagittis felis. Donec tempor, est ac mattis semper, dui lectus rutrum urna, nec luctus felis purus ac tellus. Suspendisse sed dolor. Fusce mi lorem, vehicula|40.74|9|1|44|1|6|0|2012-09-16|1|6
72|65|1|9|117/16|2012-11-24|Curabitur vel lectus. Cum sociis natoque penatibus et magnis dis parturient montes, nascetur ridiculus mus. Donec dignissim magna a tortor. Nunc commodo auctor velit. Aliquam nisl. Nulla eu|87.63|14|17|85|1|1|1|2012-11-24|1|9
73|65|1|4|304/70|2012-07-03|at lacus. Quisque purus sapien, gravida non, sollicitudin a, malesuada id, erat. Etiam vestibulum massa rutrum magna. Cras convallis convallis dolor. Quisque tincidunt pede ac urna. Ut tincidunt vehicula risus. Nulla eget metus eu erat semper rutrum. Fusce dolor quam, elementum at, egestas a, scelerisque sed, sapien. Nunc pulvinar arcu et pede. Nunc sed orci lobortis augue scelerisque mollis. Phasellus libero mauris, aliquam eu, accumsan sed, facilisis vitae, orci. Phasellus dapibus quam quis diam. Pellentesque habitant morbi tristique senectus et netus et malesuada fames ac turpis egestas. Fusce aliquet magna a neque. Nullam ut nisi a odio semper cursus. Integer|70.65|12|20|65|1|5|1|2012-07-03|1|9
74|68|1|5|100/91|2014-02-03|felis. Donec tempor, est ac mattis semper, dui lectus rutrum urna, nec luctus felis purus ac tellus. Suspendisse sed dolor. Fusce mi lorem, vehicula et, rutrum eu, ultrices sit amet, risus. Donec nibh enim, gravida sit amet, dapibus id, blandit at, nisi. Cum sociis natoque penatibus et|115.48|6|22|97|1|2|0|2014-02-03|2|7
75|65|1|8|863/41|2014-01-30|tincidunt adipiscing. Mauris molestie pharetra nibh. Aliquam ornare, libero at auctor ullamcorper, nisl arcu|72.63|19|24|69|1|5|1|2014-01-30|2|9
76|68|1|3|219/18|2012-04-07|nec, malesuada ut, sem. Nulla interdum. Curabitur dictum. Phasellus in felis. Nulla tempor augue ac ipsum. Phasellus vitae mauris sit amet lorem semper auctor. Mauris vel turpis. Aliquam adipiscing lobortis risus. In mi pede, nonummy ut, molestie in, tempus eu, ligula. Aenean euismod mauris eu elit. Nulla facilisi. Sed neque. Sed eget lacus. Mauris non dui nec urna suscipit nonummy. Fusce fermentum fermentum arcu. Vestibulum ante ipsum primis in faucibus orci luctus et ultrices posuere cubilia Curae; Phasellus ornare. Fusce mollis. Duis sit amet diam eu dolor egestas rhoncus. Proin nisl sem, consequat nec, mollis vitae, posuere|95.15|14|11|98|1|2|1|2012-04-07|1|7
77|72|1|10|066/61|2012-11-18|lobortis quam a felis ullamcorper viverra. Maecenas iaculis aliquet diam. Sed diam lorem, auctor quis, tristique ac, eleifend vitae, erat. Vivamus nisi. Mauris nulla. Integer urna. Vivamus molestie dapibus ligula. Aliquam erat volutpat. Nulla dignissim. Maecenas ornare egestas ligula. Nullam feugiat placerat velit. Quisque varius. Nam porttitor scelerisque neque. Nullam nisl. Maecenas malesuada fringilla est. Mauris|50|7|9|49|1|5|1|2012-11-18|2|6
78|14|1|9|331/37|2012-05-21|Curabitur massa. Vestibulum accumsan neque et nunc. Quisque ornare tortor at risus. Nunc ac sem ut dolor dapibus gravida. Aliquam tincidunt, nunc ac mattis ornare, lectus ante dictum mi, ac mattis velit justo nec ante. Maecenas mi felis,|34.69|21|23|34|1|7|1|2012-05-21|1|3
79|58|1|7|649/01|2012-03-08|lacus vestibulum lorem, sit amet ultricies sem magna nec quam. Curabitur vel lectus. Cum sociis natoque penatibus et magnis dis parturient montes, nascetur ridiculus mus. Donec dignissim magna a tortor. Nunc commodo auctor velit. Aliquam nisl. Nulla eu neque pellentesque massa lobortis ultrices. Vivamus rhoncus. Donec est. Nunc|59.38|0|4|57|1|5|1|2012-03-08|2|8
80|62|1|8|123/32|2013-08-31|ridiculus mus. Proin vel arcu eu odio tristique pharetra. Quisque ac libero nec ligula consectetuer|98.94|8|14|93|1|5|0|2013-08-31|2|1
81|71|1|8|449/93|2013-09-08|magna. Lorem ipsum dolor sit amet, consectetuer adipiscing elit. Etiam laoreet, libero et tristique pellentesque, tellus sem mollis dui, in sodales elit erat vitae risus. Duis a mi fringilla mi lacinia mattis. Integer eu lacus. Quisque imperdiet, erat nonummy ultricies ornare, elit elit fermentum risus, at fringilla purus mauris|77.78|5|15|70|1|5|1|2013-09-08|2|10
82|44|1|2|086/98|2012-04-20|Pellentesque tincidunt tempus risus. Donec egestas. Duis ac arcu. Nunc mauris. Morbi non sapien molestie orci tincidunt adipiscing. Mauris molestie pharetra nibh. Aliquam ornare, libero at auctor ullamcorper, nisl arcu iaculis enim, sit amet ornare lectus justo eu arcu. Morbi sit amet massa. Quisque porttitor eros nec tellus. Nunc lectus pede, ultrices a, auctor non, feugiat nec, diam. Duis mi enim, condimentum eget, volutpat ornare, facilisis eget, ipsum. Donec sollicitudin adipiscing ligula. Aenean|50|18|30|44|1|2|1|2012-04-20|1|2
83|14|1|0|524/22|2012-05-01|amet lorem semper auctor. Mauris vel turpis. Aliquam adipiscing lobortis risus. In mi pede, nonummy ut, molestie in, tempus eu, ligula. Aenean euismod mauris eu elit. Nulla facilisi. Sed neque. Sed eget lacus. Mauris non dui nec urna suscipit nonummy. Fusce fermentum fermentum arcu. Vestibulum ante ipsum primis in faucibus orci luctus et ultrices posuere cubilia Curae; Phasellus ornare. Fusce mollis. Duis sit amet diam eu dolor egestas rhoncus. Proin nisl sem, consequat nec, mollis vitae, posuere at, velit. Cras lorem lorem, luctus ut, pellentesque eget, dictum placerat, augue. Sed molestie. Sed id risus quis diam luctus|10.48|19|14|11|1|3|1|2012-05-01|2|3
84|71|1|6|624/09|2012-03-23|malesuada fames ac turpis egestas. Aliquam fringilla cursus purus. Nullam scelerisque neque sed sem egestas blandit. Nam nulla magna, malesuada vel, convallis in, cursus et, eros. Proin ultrices. Duis volutpat nunc sit amet metus. Aliquam erat volutpat. Nulla facilisis. Suspendisse commodo tincidunt nibh. Phasellus nulla. Integer vulputate, risus a ultricies adipiscing, enim mi tempor lorem, eget mollis lectus pede et risus. Quisque libero lacus, varius et, euismod et, commodo at, libero. Morbi accumsan|50.43|19|4|58|1|7|1|2012-03-23|2|10
85|58|1|2|615/62|2012-05-30|a sollicitudin orci sem eget massa. Suspendisse eleifend. Cras sed leo. Cras vehicula aliquet libero. Integer in magna. Phasellus dolor elit, pellentesque a, facilisis non, bibendum sed, est. Nunc laoreet lectus quis massa. Mauris vestibulum, neque sed dictum eleifend, nunc risus varius orci, in consequat enim diam vel arcu. Curabitur ut odio vel est tempor bibendum. Donec felis orci, adipiscing non, luctus sit amet, faucibus ut, nulla. Cras eu tellus eu augue porttitor interdum. Sed auctor odio a purus. Duis elementum, dui quis accumsan convallis, ante lectus convallis est, vitae sodales nisi magna sed dui. Fusce aliquam, enim nec|50.98|6|4|52|1|1|1|2012-05-30|2|8
86|68|1|7|198/78|2013-01-08|ipsum sodales purus, in molestie tortor nibh sit amet orci. Ut sagittis lobortis mauris. Suspendisse aliquet molestie tellus. Aenean egestas hendrerit neque. In ornare sagittis felis. Donec tempor, est ac mattis semper, dui lectus rutrum urna, nec luctus felis purus ac tellus. Suspendisse sed dolor. Fusce mi lorem, vehicula et, rutrum eu, ultrices sit amet, risus. Donec|50.54|11|18|47|1|1|1|2013-01-08|1|7
87|72|1|1|852/24|2013-05-29|erat. Etiam vestibulum massa rutrum magna. Cras convallis convallis dolor. Quisque tincidunt pede ac urna.|96.81|18|24|91|1|5|1|2013-05-29|1|6
88|68|1|0|835/20|2013-07-08|dui. Suspendisse ac metus vitae velit egestas lacinia. Sed congue, elit sed consequat auctor, nunc nulla vulputate dui, nec tempus mauris erat eget ipsum. Suspendisse sagittis. Nullam vitae diam. Proin dolor. Nulla semper tellus id nunc interdum feugiat. Sed nec metus facilisis lorem tristique aliquet. Phasellus fermentum convallis ligula. Donec luctus aliquet odio. Etiam ligula tortor, dictum eu, placerat eget, venenatis a, magna. Lorem ipsum dolor sit amet, consectetuer adipiscing elit.|68.18|8|20|60|1|3|0|2013-07-08|2|7
89|65|1|7|473/32|2013-01-17|gravida. Praesent eu nulla at sem molestie sodales. Mauris blandit enim consequat purus. Maecenas libero est, congue a, aliquet vel, vulputate eu, odio. Phasellus at augue id ante dictum cursus. Nunc|50.56|18|29|45|1|6|1|2013-01-17|2|9
90|0|1|6|052/50|2013-04-24|tortor. Nunc commodo auctor velit. Aliquam nisl. Nulla eu neque pellentesque massa lobortis ultrices. Vivamus rhoncus. Donec est. Nunc ullamcorper, velit in aliquet lobortis, nisi nibh lacinia orci, consectetuer euismod est arcu ac orci. Ut semper pretium neque. Morbi quis urna. Nunc quis arcu vel quam dignissim pharetra. Nam ac nulla. In tincidunt congue turpis. In condimentum. Donec at arcu. Vestibulum ante ipsum|92.55|5|11|87|1|1|1|2013-04-24|1|0
91|65|1|2|430/72|2013-03-23|luctus felis purus ac tellus. Suspendisse sed dolor. Fusce mi lorem, vehicula et, rutrum eu, ultrices sit amet, risus. Donec nibh enim, gravida sit amet, dapibus id, blandit at, nisi. Cum sociis natoque penatibus et magnis dis parturient montes, nascetur ridiculus mus. Proin vel nisl. Quisque fringilla euismod enim. Etiam gravida molestie arcu. Sed eu nibh vulputate mauris sagittis placerat. Cras dictum ultricies ligula. Nullam enim. Sed nulla ante, iaculis nec, eleifend non, dapibus|82.52|12|9|85|1|3|0|2013-03-23|2|9
92|65|1|6|329/21|2012-05-19|sem mollis dui, in sodales elit erat vitae risus. Duis a mi fringilla mi lacinia mattis. Integer eu lacus. Quisque imperdiet, erat nonummy ultricies ornare, elit elit fermentum risus, at fringilla purus mauris a nunc. In at pede. Cras vulputate velit eu sem. Pellentesque ut ipsum ac mi eleifend egestas. Sed pharetra, felis eget varius ultrices, mauris ipsum porta elit, a feugiat tellus lorem eu metus. In lorem. Donec elementum, lorem ut|107.61|16|24|99|1|7|0|2012-05-19|1|9
93|92|1|4|236/05|2012-09-06|dolor elit, pellentesque a, facilisis non, bibendum sed, est. Nunc laoreet lectus quis massa. Mauris vestibulum, neque sed dictum eleifend, nunc risus varius orci, in consequat enim diam vel arcu. Curabitur ut odio vel est tempor bibendum. Donec felis orci, adipiscing non, luctus sit amet, faucibus ut, nulla. Cras eu tellus eu augue porttitor interdum. Sed auctor odio a purus. Duis elementum, dui quis accumsan convallis, ante lectus convallis est, vitae sodales nisi magna sed dui. Fusce aliquam, enim nec tempus scelerisque, lorem ipsum sodales purus, in molestie tortor nibh sit amet orci. Ut sagittis lobortis mauris. Suspendisse aliquet|114.94|19|32|100|1|3|0|2012-09-06|1|5
94|0|1|3|880/89|2013-05-19|augue id ante dictum cursus. Nunc mauris elit, dictum eu, eleifend nec, malesuada ut, sem. Nulla interdum. Curabitur dictum.|86.32|21|26|82|1|5|0|2013-05-19|1|0
95|0|1|5|794/74|2012-08-12|mattis ornare, lectus ante dictum mi, ac mattis velit justo nec ante. Maecenas mi felis, adipiscing fringilla, porttitor vulputate, posuere vulputate, lacus. Cras interdum. Nunc sollicitudin commodo ipsum. Suspendisse non leo. Vivamus nibh dolor, nonummy ac, feugiat non, lobortis quis, pede. Suspendisse dui. Fusce diam nunc, ullamcorper eu, euismod ac, fermentum vel, mauris. Integer sem elit, pharetra ut, pharetra sed, hendrerit a, arcu. Sed et libero. Proin mi. Aliquam gravida mauris ut mi. Duis|106.52|5|13|98|1|2|1|2012-08-12|2|0
96|71|1|2|760/50|2013-09-11|at arcu. Vestibulum ante ipsum primis in faucibus orci luctus|34.12|2|17|29|1|2|0|2013-09-11|1|10
97|14|1|10|402/45|2013-10-25|mollis vitae, posuere at, velit. Cras lorem lorem, luctus ut, pellentesque eget, dictum placerat, augue. Sed molestie. Sed id risus quis diam luctus lobortis. Class aptent taciti sociosqu ad litora torquent per conubia nostra, per inceptos hymenaeos. Mauris ut quam vel sapien imperdiet ornare. In faucibus. Morbi vehicula. Pellentesque tincidunt tempus risus. Donec egestas. Duis ac arcu. Nunc|78.76|13|0|89|1|5|1|2013-10-25|2|3
98|72|1|0|895/06|2013-11-24|at sem molestie sodales. Mauris blandit enim consequat purus. Maecenas libero est, congue a, aliquet vel, vulputate eu, odio. Phasellus at augue id ante dictum cursus. Nunc mauris elit, dictum eu, eleifend nec, malesuada ut, sem. Nulla interdum. Curabitur dictum. Phasellus in felis. Nulla tempor augue ac ipsum. Phasellus vitae mauris sit amet lorem semper auctor. Mauris vel turpis. Aliquam adipiscing lobortis risus. In mi pede, nonummy ut, molestie in, tempus eu, ligula. Aenean euismod mauris eu|61.8|15|26|55|1|1|1|2013-11-24|1|6
99|44|1|9|208/19|2012-07-19|nec quam. Curabitur vel lectus. Cum sociis natoque penatibus et magnis dis parturient montes, nascetur ridiculus mus. Donec dignissim magna a tortor. Nunc commodo auctor velit. Aliquam nisl. Nulla eu neque pellentesque massa lobortis ultrices. Vivamus rhoncus. Donec est. Nunc ullamcorper, velit in aliquet lobortis, nisi nibh lacinia orci, consectetuer euismod est arcu ac orci. Ut semper pretium neque. Morbi quis urna. Nunc quis|71.03|19|12|76|1|1|1|2012-07-19|1|2
100|72|1|4|081/55|2013-01-13|arcu. Aliquam ultrices iaculis odio. Nam interdum enim non nisi. Aenean eget metus. In nec orci. Donec nibh. Quisque nonummy ipsum non arcu. Vivamus sit amet risus. Donec egestas. Aliquam nec enim. Nunc ut erat.|79.46|18|6|89|1|7|1|2013-01-13|2|6

