id|nombre|descripcion|dstart|dstop|id_estado
54|eget, volutpat ornare, facilisis eget, ipsum. Donec sollicitudin adipiscing ligula.|Mauris eu turpis. Nulla aliquet. Proin velit. Sed malesuada augue ut lacus. Nulla tincidunt, neque vitae semper egestas, urna justo faucibus lectus, a sollicitudin orci sem eget massa. Suspendisse eleifend. Cras sed leo. Cras vehicula aliquet libero. Integer in magna. Phasellus dolor elit, pellentesque a, facilisis non, bibendum sed, est. Nunc laoreet|2013-10-20 01:58:35|2014-02-20 13:13:19|1
55|lorem, eget mollis lectus pede|Nam ac nulla. In tincidunt congue turpis. In condimentum. Donec at arcu. Vestibulum ante ipsum primis in faucibus orci luctus et ultrices posuere cubilia Curae; Donec tincidunt. Donec vitae erat vel pede blandit congue. In scelerisque scelerisque dui. Suspendisse ac metus vitae velit egestas lacinia. Sed congue, elit sed consequat auctor, nunc nulla vulputate dui, nec tempus mauris erat eget ipsum. Suspendisse sagittis. Nullam vitae diam. Proin dolor. Nulla semper tellus id nunc interdum feugiat. Sed nec metus|2013-11-24 03:17:55|2013-04-07 10:05:17|1
56|lorem lorem, luctus ut, pellentesque eget, dictum placerat, augue. Sed|Vivamus sit amet risus. Donec egestas. Aliquam nec enim. Nunc ut erat.|2013-09-02 18:01:43|2012-05-31 05:49:17|5
57|natoque penatibus et magnis dis|luctus, ipsum leo elementum sem, vitae aliquam eros turpis non enim. Mauris quis turpis vitae purus gravida sagittis. Duis gravida. Praesent eu nulla at sem molestie sodales. Mauris blandit enim consequat purus. Maecenas libero est, congue a, aliquet vel, vulputate eu, odio. Phasellus at augue id ante dictum cursus. Nunc mauris elit, dictum eu,|2013-11-30 18:30:58|2012-05-25 22:35:46|1
58|nisi dictum augue malesuada malesuada. Integer id magna|facilisis, magna tellus faucibus leo, in lobortis tellus justo sit amet nulla. Donec non justo. Proin non massa non ante bibendum ullamcorper. Duis cursus, diam at pretium aliquet, metus urna convallis erat, eget tincidunt dui augue eu tellus. Phasellus elit pede, malesuada vel, venenatis vel, faucibus id, libero. Donec consectetuer mauris id sapien. Cras dolor dolor, tempus non, lacinia at, iaculis quis, pede. Praesent eu dui. Cum sociis natoque penatibus et magnis dis parturient montes, nascetur ridiculus mus. Aenean eget magna. Suspendisse tristique neque venenatis lacus. Etiam bibendum fermentum metus. Aenean sed pede nec ante blandit viverra.|2014-02-11 13:56:45|2012-07-14 11:13:15|10
59|lobortis augue scelerisque mollis. Phasellus libero mauris,|Suspendisse non leo. Vivamus nibh dolor, nonummy ac, feugiat non, lobortis quis, pede. Suspendisse dui. Fusce diam nunc, ullamcorper eu, euismod ac, fermentum vel, mauris.|2013-11-14 17:43:24|2014-02-20 11:51:03|5
60|neque sed sem egestas blandit. Nam|magnis dis parturient montes, nascetur ridiculus mus. Aenean eget magna. Suspendisse tristique neque venenatis lacus. Etiam bibendum fermentum metus. Aenean sed pede nec ante blandit viverra. Donec tempus, lorem fringilla ornare placerat, orci lacus vestibulum lorem, sit amet ultricies sem magna nec quam. Curabitur vel lectus. Cum sociis natoque penatibus et magnis dis parturient montes, nascetur ridiculus mus. Donec dignissim magna a tortor. Nunc commodo auctor velit. Aliquam nisl. Nulla eu neque pellentesque massa lobortis ultrices. Vivamus rhoncus. Donec est. Nunc|2013-12-03 00:01:24|2012-07-03 22:00:32|2
61|Curae; Donec tincidunt. Donec vitae erat vel pede blandit congue.|consectetuer mauris id sapien. Cras dolor dolor, tempus non, lacinia at, iaculis quis, pede. Praesent eu dui. Cum sociis natoque penatibus et magnis|2013-02-09 05:05:08|2012-06-05 08:27:19|5
62|blandit mattis. Cras eget nisi dictum|per conubia nostra, per inceptos hymenaeos. Mauris ut quam vel sapien imperdiet ornare. In faucibus. Morbi vehicula. Pellentesque tincidunt tempus risus. Donec egestas. Duis ac arcu. Nunc mauris. Morbi non sapien molestie orci tincidunt adipiscing. Mauris molestie pharetra nibh. Aliquam ornare, libero at auctor ullamcorper, nisl arcu iaculis enim, sit amet ornare lectus justo eu arcu. Morbi sit amet massa. Quisque porttitor eros nec tellus. Nunc lectus pede, ultrices a, auctor non, feugiat nec, diam. Duis mi|2012-07-08 22:32:57|2014-01-30 17:04:09|7
63|ornare egestas ligula. Nullam feugiat placerat|dui, nec tempus mauris erat eget ipsum. Suspendisse sagittis. Nullam vitae diam. Proin dolor. Nulla semper tellus id nunc interdum feugiat. Sed nec metus facilisis lorem tristique aliquet. Phasellus fermentum convallis ligula. Donec luctus aliquet odio. Etiam|2012-09-04 20:11:51|2013-02-25 00:24:30|5
64|felis ullamcorper viverra. Maecenas iaculis aliquet diam.|quam a felis ullamcorper viverra. Maecenas iaculis aliquet diam. Sed diam lorem, auctor quis, tristique ac, eleifend vitae,|2013-05-19 15:35:09|2012-11-22 14:25:10|0
65|Nam ac nulla. In tincidunt|dictum cursus. Nunc mauris elit, dictum eu, eleifend nec, malesuada ut, sem. Nulla interdum.|2013-01-01 15:36:36|2013-12-15 06:58:45|7
66|est. Mauris eu turpis. Nulla aliquet. Proin velit.|Aliquam ornare, libero at auctor ullamcorper, nisl arcu iaculis enim, sit amet ornare lectus justo eu arcu. Morbi sit amet massa. Quisque porttitor eros nec tellus. Nunc lectus pede, ultrices a, auctor non, feugiat nec, diam. Duis mi enim, condimentum eget, volutpat ornare, facilisis eget, ipsum. Donec sollicitudin adipiscing ligula. Aenean gravida nunc sed pede. Cum sociis natoque|2013-03-26 15:27:28|2012-09-25 23:59:34|0
67|Curabitur dictum. Phasellus in felis. Nulla tempor augue ac|consectetuer ipsum nunc id enim. Curabitur massa. Vestibulum accumsan neque et nunc. Quisque ornare tortor at risus. Nunc ac sem ut dolor dapibus gravida. Aliquam tincidunt, nunc ac mattis ornare, lectus ante dictum mi, ac mattis velit justo nec ante. Maecenas mi felis, adipiscing fringilla, porttitor vulputate, posuere vulputate, lacus. Cras interdum. Nunc sollicitudin commodo ipsum. Suspendisse non leo. Vivamus nibh dolor, nonummy ac, feugiat non, lobortis quis, pede. Suspendisse dui. Fusce diam nunc, ullamcorper eu, euismod ac, fermentum vel, mauris. Integer sem|2013-09-09 18:55:54|2014-02-08 08:14:14|9
68|lobortis risus. In mi pede, nonummy|egestas a, scelerisque sed, sapien. Nunc pulvinar arcu et pede. Nunc sed orci lobortis augue scelerisque mollis. Phasellus libero mauris, aliquam eu, accumsan sed, facilisis vitae, orci. Phasellus dapibus quam quis diam. Pellentesque habitant morbi tristique senectus et netus et malesuada fames ac turpis|2013-10-14 05:08:17|2013-07-30 17:37:28|5
69|sed pede. Cum sociis natoque|condimentum eget, volutpat ornare, facilisis eget, ipsum. Donec sollicitudin adipiscing ligula. Aenean gravida nunc sed pede. Cum sociis natoque penatibus et magnis dis parturient montes, nascetur ridiculus mus. Proin vel arcu eu odio tristique pharetra. Quisque ac libero nec ligula consectetuer rhoncus. Nullam velit dui, semper et, lacinia vitae, sodales at, velit. Pellentesque ultricies dignissim lacus. Aliquam rutrum lorem ac risus. Morbi metus. Vivamus euismod urna. Nullam lobortis quam a felis ullamcorper viverra. Maecenas iaculis aliquet diam. Sed diam lorem, auctor quis, tristique ac, eleifend vitae, erat. Vivamus|2012-06-05 19:04:59|2013-12-21 23:14:07|1
70|et ultrices posuere cubilia Curae; Donec tincidunt.|molestie tortor nibh sit amet orci. Ut sagittis lobortis mauris. Suspendisse aliquet molestie tellus. Aenean egestas hendrerit neque. In ornare sagittis felis. Donec tempor, est ac mattis semper, dui lectus rutrum urna, nec luctus felis purus ac tellus. Suspendisse sed dolor. Fusce mi lorem, vehicula et, rutrum eu, ultrices sit amet,|2012-03-17 03:45:28|2012-05-12 08:34:33|1
71|rutrum urna, nec luctus felis purus ac|amet orci. Ut sagittis lobortis mauris. Suspendisse aliquet molestie tellus. Aenean egestas hendrerit neque. In ornare sagittis felis. Donec tempor, est ac mattis semper, dui lectus rutrum urna, nec luctus felis purus ac tellus. Suspendisse sed dolor. Fusce mi lorem, vehicula et, rutrum eu, ultrices sit amet, risus. Donec nibh enim, gravida sit amet, dapibus id, blandit at, nisi. Cum sociis natoque penatibus et magnis dis parturient montes, nascetur ridiculus mus. Proin vel nisl. Quisque fringilla euismod enim. Etiam gravida molestie arcu. Sed eu|2013-06-13 15:01:59|2012-05-14 09:23:36|7
72|Etiam vestibulum massa rutrum magna. Cras convallis|convallis dolor. Quisque tincidunt pede ac urna. Ut tincidunt vehicula risus. Nulla eget metus eu erat|2012-05-19 22:10:36|2013-10-05 16:31:51|3
73|ipsum porta elit, a feugiat|tincidunt, nunc ac mattis ornare, lectus ante dictum mi, ac mattis velit justo nec ante. Maecenas mi felis, adipiscing fringilla, porttitor vulputate, posuere vulputate, lacus. Cras interdum. Nunc sollicitudin commodo ipsum. Suspendisse non leo. Vivamus nibh dolor, nonummy ac, feugiat non, lobortis quis, pede. Suspendisse dui. Fusce diam nunc, ullamcorper eu, euismod ac, fermentum vel, mauris.|2013-04-19 10:34:59|2012-06-28 15:04:26|8
74|diam luctus lobortis. Class aptent taciti sociosqu|sociis natoque penatibus et magnis dis parturient montes, nascetur ridiculus mus. Donec dignissim magna a tortor. Nunc commodo auctor velit. Aliquam nisl. Nulla eu neque pellentesque massa lobortis ultrices. Vivamus rhoncus. Donec est. Nunc ullamcorper, velit in aliquet lobortis, nisi nibh lacinia orci, consectetuer euismod est arcu ac orci. Ut semper pretium neque. Morbi quis urna. Nunc quis arcu vel quam dignissim pharetra. Nam ac nulla. In tincidunt congue turpis. In condimentum. Donec at arcu. Vestibulum ante ipsum primis in faucibus orci luctus et ultrices posuere cubilia Curae; Donec tincidunt. Donec vitae erat vel pede blandit congue. In scelerisque scelerisque|2013-05-25 00:30:27|2012-04-22 14:55:17|3
75|eget ipsum. Suspendisse sagittis. Nullam vitae diam.|ipsum. Donec sollicitudin adipiscing ligula. Aenean gravida nunc sed pede. Cum sociis natoque penatibus et magnis dis parturient montes, nascetur ridiculus mus. Proin vel arcu eu odio tristique pharetra. Quisque ac libero nec ligula consectetuer rhoncus. Nullam velit dui, semper et, lacinia vitae, sodales at, velit. Pellentesque ultricies dignissim lacus. Aliquam rutrum lorem ac risus. Morbi metus. Vivamus euismod urna. Nullam lobortis quam a felis ullamcorper|2012-03-16 12:59:43|2012-10-29 20:17:59|0
76|ipsum primis in faucibus orci luctus et ultrices posuere|at sem molestie sodales. Mauris blandit enim consequat purus. Maecenas libero est, congue a, aliquet vel, vulputate eu, odio. Phasellus at augue id ante dictum cursus. Nunc mauris elit, dictum eu, eleifend nec, malesuada ut, sem. Nulla interdum. Curabitur dictum. Phasellus in felis. Nulla tempor augue ac ipsum. Phasellus vitae mauris sit amet lorem semper auctor. Mauris vel turpis. Aliquam adipiscing lobortis risus. In mi pede, nonummy ut, molestie in, tempus eu, ligula. Aenean euismod mauris eu elit. Nulla facilisi. Sed neque. Sed eget|2013-11-29 10:28:06|2013-07-09 16:22:24|2
77|eu tellus. Phasellus elit pede, malesuada vel, venenatis vel, faucibus|est. Nunc ullamcorper, velit in aliquet lobortis, nisi nibh lacinia orci, consectetuer euismod est arcu ac orci. Ut semper pretium neque. Morbi quis urna. Nunc quis arcu vel quam dignissim pharetra. Nam ac nulla. In tincidunt congue turpis. In condimentum. Donec at arcu. Vestibulum ante ipsum primis in faucibus orci luctus et ultrices posuere cubilia Curae; Donec tincidunt. Donec vitae erat vel pede blandit congue. In scelerisque scelerisque dui. Suspendisse ac metus vitae velit egestas|2013-04-06 14:14:03|2012-03-04 05:18:11|1
78|suscipit nonummy. Fusce fermentum fermentum arcu. Vestibulum|odio a purus. Duis elementum, dui quis accumsan convallis, ante lectus convallis est, vitae sodales nisi magna sed dui. Fusce aliquam, enim nec tempus|2013-05-06 23:05:41|2012-09-14 20:04:15|2
79|justo sit amet nulla. Donec non justo.|nec, imperdiet nec, leo. Morbi neque tellus, imperdiet non, vestibulum nec, euismod in, dolor. Fusce feugiat. Lorem|2012-10-02 23:55:02|2012-12-01 00:45:57|6
80|gravida nunc sed pede. Cum sociis natoque penatibus et magnis|fermentum risus, at fringilla purus mauris a nunc. In at pede. Cras vulputate velit eu sem. Pellentesque ut ipsum ac mi eleifend egestas. Sed pharetra, felis eget varius ultrices, mauris ipsum porta elit, a feugiat tellus lorem eu metus. In lorem. Donec elementum, lorem ut aliquam iaculis, lacus pede sagittis augue, eu tempor erat neque non quam. Pellentesque habitant morbi tristique senectus et netus et malesuada fames ac turpis egestas. Aliquam fringilla cursus purus. Nullam scelerisque neque sed sem egestas blandit. Nam nulla magna,|2012-10-03 06:45:28|2014-02-07 02:24:39|0
81|nunc sed pede. Cum sociis|Ut semper pretium neque. Morbi quis urna. Nunc quis arcu vel quam dignissim pharetra. Nam ac nulla. In tincidunt congue turpis. In condimentum. Donec at arcu. Vestibulum ante ipsum primis in faucibus orci luctus et ultrices posuere cubilia Curae; Donec tincidunt. Donec vitae erat vel pede blandit congue. In scelerisque scelerisque dui. Suspendisse ac metus vitae velit egestas lacinia. Sed congue, elit sed consequat auctor, nunc nulla vulputate dui, nec tempus mauris erat eget ipsum. Suspendisse sagittis. Nullam vitae diam. Proin dolor. Nulla|2014-01-11 18:48:55|2013-04-03 16:04:30|7
82|lectus convallis est, vitae sodales nisi magna sed dui. Fusce|est. Nunc ullamcorper, velit in aliquet lobortis, nisi nibh lacinia orci, consectetuer euismod est arcu ac orci. Ut semper pretium neque. Morbi quis urna. Nunc quis arcu vel quam dignissim pharetra. Nam ac nulla. In tincidunt congue turpis. In condimentum. Donec at arcu. Vestibulum ante|2012-06-28 05:28:53|2012-08-29 00:51:30|7
83|mauris id sapien. Cras dolor dolor, tempus non,|volutpat ornare, facilisis eget, ipsum. Donec sollicitudin adipiscing ligula. Aenean gravida nunc sed pede. Cum sociis natoque penatibus et magnis dis parturient montes, nascetur ridiculus mus. Proin vel arcu eu odio tristique pharetra. Quisque|2012-05-19 09:44:08|2014-01-04 00:04:37|4
84|Nunc quis arcu vel quam dignissim pharetra.|gravida molestie arcu. Sed eu nibh vulputate mauris sagittis placerat. Cras dictum ultricies ligula. Nullam enim. Sed nulla ante, iaculis nec, eleifend non, dapibus rutrum, justo. Praesent luctus. Curabitur egestas nunc sed libero. Proin sed turpis nec mauris blandit mattis. Cras eget nisi dictum augue malesuada malesuada. Integer id magna et ipsum cursus vestibulum. Mauris magna. Duis dignissim tempor arcu. Vestibulum ut eros|2012-08-06 00:02:50|2012-04-23 11:22:09|1
85|convallis dolor. Quisque tincidunt pede ac urna. Ut tincidunt vehicula|Duis volutpat nunc sit amet metus. Aliquam erat volutpat. Nulla facilisis. Suspendisse commodo tincidunt nibh. Phasellus nulla. Integer vulputate, risus a ultricies adipiscing, enim mi tempor lorem, eget mollis lectus pede et risus. Quisque libero lacus, varius et, euismod et, commodo at, libero. Morbi accumsan laoreet ipsum. Curabitur consequat, lectus sit amet luctus vulputate, nisi sem semper erat, in consectetuer ipsum nunc id enim. Curabitur massa. Vestibulum accumsan neque et nunc. Quisque ornare tortor at risus. Nunc ac sem ut dolor|2012-06-26 21:44:41|2013-12-02 03:59:27|0
86|dictum eu, placerat eget, venenatis a, magna.|enim consequat purus. Maecenas libero est, congue a, aliquet vel, vulputate eu, odio. Phasellus at augue id ante dictum cursus. Nunc mauris elit, dictum eu, eleifend nec, malesuada ut, sem. Nulla interdum. Curabitur dictum. Phasellus in felis. Nulla tempor augue|2012-04-29 15:25:53|2012-07-12 21:45:47|6
87|ullamcorper, nisl arcu iaculis enim, sit amet|eu, odio. Phasellus at augue id ante dictum cursus. Nunc mauris elit, dictum eu, eleifend nec, malesuada ut, sem. Nulla interdum. Curabitur dictum. Phasellus in felis. Nulla tempor augue ac ipsum. Phasellus vitae mauris sit amet lorem semper auctor. Mauris vel turpis. Aliquam adipiscing lobortis risus. In mi pede, nonummy ut, molestie in, tempus eu, ligula. Aenean euismod mauris eu elit. Nulla facilisi. Sed neque. Sed eget lacus. Mauris non dui nec urna suscipit nonummy. Fusce fermentum fermentum arcu. Vestibulum ante ipsum primis in faucibus orci luctus et ultrices posuere cubilia Curae; Phasellus ornare. Fusce mollis. Duis|2012-12-05 08:09:27|2012-06-22 05:56:07|0
88|Integer tincidunt aliquam arcu. Aliquam ultrices iaculis odio.|pharetra sed, hendrerit a, arcu. Sed et libero. Proin mi. Aliquam gravida mauris ut mi. Duis risus odio, auctor vitae, aliquet nec, imperdiet nec, leo. Morbi neque tellus, imperdiet non, vestibulum nec, euismod in, dolor. Fusce feugiat. Lorem ipsum dolor sit amet, consectetuer adipiscing elit. Aliquam auctor, velit eget laoreet posuere, enim nisl elementum purus, accumsan|2013-07-05 04:57:53|2013-11-27 14:50:53|8
89|magna tellus faucibus leo, in|turpis. Nulla aliquet. Proin velit. Sed malesuada augue ut lacus. Nulla tincidunt, neque vitae semper egestas, urna justo faucibus lectus, a sollicitudin orci sem eget massa. Suspendisse eleifend. Cras sed leo. Cras vehicula aliquet libero. Integer in magna. Phasellus dolor elit, pellentesque a, facilisis non, bibendum sed, est. Nunc|2013-04-04 06:15:18|2012-04-20 18:23:42|10
90|mi lacinia mattis. Integer eu lacus. Quisque imperdiet, erat|Mauris nulla. Integer urna. Vivamus molestie dapibus ligula. Aliquam erat volutpat. Nulla dignissim. Maecenas ornare egestas ligula. Nullam feugiat placerat velit. Quisque varius. Nam porttitor scelerisque neque. Nullam nisl. Maecenas malesuada fringilla est. Mauris eu turpis. Nulla aliquet. Proin velit. Sed malesuada augue ut lacus. Nulla tincidunt, neque vitae semper egestas, urna justo faucibus lectus, a sollicitudin orci sem eget massa. Suspendisse eleifend. Cras sed leo. Cras vehicula|2013-09-23 08:03:43|2014-01-24 05:25:09|3
91|Vestibulum ante ipsum primis in faucibus orci luctus et|cursus et, magna. Praesent interdum ligula eu enim. Etiam imperdiet dictum magna. Ut tincidunt orci quis lectus. Nullam suscipit, est ac facilisis facilisis, magna tellus faucibus leo, in lobortis tellus justo sit amet nulla. Donec non justo. Proin non massa non ante bibendum ullamcorper.|2013-05-25 02:10:30|2012-04-18 07:39:36|1
92|non, lobortis quis, pede. Suspendisse dui. Fusce|mus. Donec dignissim magna a tortor. Nunc commodo auctor velit. Aliquam nisl. Nulla eu neque pellentesque massa lobortis ultrices. Vivamus rhoncus. Donec est. Nunc ullamcorper, velit in aliquet lobortis, nisi nibh lacinia orci, consectetuer euismod est arcu ac orci. Ut semper pretium neque. Morbi quis urna. Nunc quis arcu vel quam dignissim pharetra. Nam ac nulla. In tincidunt congue turpis. In condimentum. Donec at arcu. Vestibulum ante ipsum primis in faucibus orci luctus et ultrices posuere cubilia Curae; Donec tincidunt. Donec vitae erat vel pede blandit congue. In scelerisque scelerisque dui. Suspendisse ac|2012-03-22 17:44:46|2012-06-25 06:53:25|1
93|cursus non, egestas a, dui. Cras pellentesque. Sed|felis purus ac tellus. Suspendisse sed dolor. Fusce mi lorem, vehicula et, rutrum eu, ultrices sit amet, risus. Donec nibh enim, gravida sit amet, dapibus id, blandit at, nisi. Cum sociis natoque penatibus et magnis dis parturient montes, nascetur ridiculus mus. Proin vel nisl. Quisque fringilla euismod|2013-09-12 04:15:32|2013-12-28 14:03:05|3
94|feugiat metus sit amet ante. Vivamus non|posuere vulputate, lacus. Cras interdum. Nunc sollicitudin commodo ipsum. Suspendisse non leo. Vivamus nibh dolor, nonummy ac, feugiat non, lobortis quis, pede. Suspendisse dui. Fusce diam nunc, ullamcorper eu, euismod ac, fermentum vel, mauris. Integer sem elit, pharetra ut, pharetra sed, hendrerit a,|2013-11-06 09:32:12|2013-06-23 22:29:01|1
95|est, mollis non, cursus non, egestas|porttitor tellus non magna. Nam ligula elit, pretium et, rutrum non, hendrerit id, ante. Nunc mauris sapien, cursus in, hendrerit consectetuer, cursus et, magna. Praesent interdum ligula eu enim. Etiam imperdiet dictum magna. Ut tincidunt orci quis lectus. Nullam suscipit, est ac facilisis facilisis, magna tellus faucibus leo, in lobortis tellus justo sit amet nulla. Donec non justo. Proin non massa non ante bibendum ullamcorper. Duis cursus, diam at pretium aliquet, metus urna convallis erat,|2012-04-06 05:06:28|2013-05-04 18:16:12|5
96|augue ut lacus. Nulla tincidunt, neque vitae semper|mauris. Morbi non sapien molestie orci tincidunt adipiscing. Mauris molestie pharetra nibh. Aliquam ornare, libero at auctor ullamcorper, nisl arcu iaculis enim, sit amet ornare lectus justo eu arcu. Morbi sit amet massa. Quisque porttitor eros nec tellus.|2013-06-28 06:41:18|2012-12-01 11:50:32|8
97|est, mollis non, cursus non, egestas a, dui. Cras|sed orci lobortis augue scelerisque mollis. Phasellus libero mauris, aliquam eu,|2012-03-30 14:45:06|2013-02-21 03:04:30|7
98|Curabitur ut odio vel est|Nullam ut nisi a odio semper cursus. Integer mollis. Integer tincidunt aliquam arcu. Aliquam ultrices iaculis odio. Nam interdum enim non nisi. Aenean eget metus. In nec orci. Donec nibh. Quisque nonummy ipsum non arcu. Vivamus sit amet risus. Donec egestas. Aliquam nec enim. Nunc ut erat. Sed nunc est, mollis non, cursus non, egestas a, dui. Cras pellentesque. Sed dictum. Proin eget odio. Aliquam vulputate ullamcorper magna. Sed|2012-10-21 20:37:54|2012-05-14 08:51:30|1
99|vel, faucibus id, libero. Donec consectetuer mauris id sapien.|Phasellus vitae mauris sit amet lorem semper auctor. Mauris vel turpis. Aliquam adipiscing lobortis risus. In mi pede, nonummy ut, molestie in, tempus eu, ligula. Aenean euismod mauris eu elit. Nulla facilisi. Sed neque.|2012-11-12 12:20:53|2013-10-14 21:36:43|1
100|magna. Suspendisse tristique neque venenatis lacus. Etiam bibendum|risus. Nunc ac sem ut dolor dapibus gravida. Aliquam tincidunt, nunc ac mattis ornare, lectus ante dictum mi, ac mattis velit justo nec ante. Maecenas mi felis, adipiscing fringilla, porttitor vulputate, posuere vulputate, lacus.|2012-06-02 20:55:17|2014-02-12 10:59:29|6

